{
  "schema_version": "1.0.0",
  "skill": "reconcile-ekyte",
  "client_id": "acme-demo",
  "generated_at": "2026-01-20T09:15:00Z",
  "status": "success",
  "capability": "API",
  "comparisons": [
    {
      "task_id": "t-88089e96033baf68",
      "classification": "MATCHED",
      "local": {
        "status": "pending",
        "due_at": "2026-01-23",
        "external_id": "fake-1"
      },
      "remote": {
        "status": "open",
        "due_at": "2026-01-23"
      },
      "details": "local and remote agree"
    },
    {
      "task_id": "acme-demo-task-002",
      "classification": "LOCAL_ONLY",
      "local": {
        "status": "completed",
        "due_at": "2026-01-10",
        "external_id": null
      },
      "remote": null,
      "details": "never published — no external binding"
    },
    {
      "task_id": "acme-demo-task-003",
      "classification": "LOCAL_ONLY",
      "local": {
        "status": "cancelled",
        "due_at": "2026-01-08",
        "external_id": null
      },
      "remote": null,
      "details": "never published — no external binding"
    }
  ],
  "summary": {
    "matched": 1,
    "local_only": 2,
    "remote_only": 0,
    "status_mismatch": 0,
    "due_date_mismatch": 0,
    "unknown": 0
  },
  "limitations": [
    "REMOTE_ONLY nao pode ser detectado sem uma lista de tasks remotas, que o transport minimo atual nao fornece."
  ],
  "warnings": []
}